{
  "schema_version": "interpretation-context-v1",
  "context_id": "synthetic-example-17-line-2",
  "rules_version": "mvp1-logic-2026-10-11-v2",
  "question": "Giải thích cấu trúc quẻ và điểm bộ số trong dữ liệu minh họa.",
  "computed_facts": {
    "primary_useful_element": "Mộc",
    "bazi_source": "SYNTHETIC_TEST_CONTEXT; not a computed natal chart",
    "maihoa": {
      "core_version": "maihoa-ymdh-v1",
      "variables": {
        "Y": 7,
        "M": 9,
        "D": 2,
        "H": 2
      },
      "upper": 2,
      "lower": 4,
      "moving_line": 2,
      "original": {
        "id": 17,
        "name_zh": "随",
        "lines_bottom_to_top": [
          1,
          0,
          0,
          1,
          1,
          0
        ],
        "evidence_ids": [
          "iching:17:hexagram",
          "iching:17:line:2"
        ]
      },
      "the_element": "Kim",
      "dung_element": "Mộc",
      "state": "THU_CAT"
    },
    "number_result": {
      "numbers": [
        "00",
        "01",
        "09",
        "10",
        "19",
        "20"
      ],
      "status": "OPTIMAL",
      "score": 98.4,
      "threshold": 75,
      "G_raw": 121.66666666666667,
      "G_cap": 125.0,
      "attempts": 1,
      "remediation": {
        "enabled": false,
        "target_element": null,
        "quota_min": 3,
        "quota_max": 4
      }
    },
    "time_context": {
      "civil_datetime": "2026-10-11T01:30:00+07:00",
      "actual_utc_instant": "2026-10-10T18:30:00Z",
      "tst_clock": "2026-10-11T01:30:00",
      "effective_date": "2026-10-11",
      "calendar_algorithm_id": "hnd-simplified-vn-utc7-v0.1",
      "calendar_validation_status": "EXPERIMENTAL",
      "boundary_status": "UNKNOWN_UNCERTAINTY"
    }
  },
  "display_hexagrams": {
    "mutual": {
      "id": 53,
      "name_zh": "渐",
      "lines_bottom_to_top": [
        0,
        0,
        1,
        0,
        1,
        1
      ],
      "evidence_ids": []
    },
    "changed": {
      "id": 58,
      "name_zh": "兑",
      "lines_bottom_to_top": [
        1,
        1,
        0,
        1,
        1,
        0
      ],
      "evidence_ids": []
    },
    "affects_generation": false,
    "affects_evaluation": false,
    "display_on_demand": true
  },
  "evidence": [
    {
      "evidence_id": "iching:17:hexagram",
      "label": "SOURCE_ORIGINAL",
      "text_kind": "HEXAGRAM_TEXT",
      "hexagram_id": 17,
      "line_position": null,
      "language": "zh",
      "text": "元亨，利贞，无咎。",
      "source": {
        "repository": "john-walks-slow/open-iching",
        "commit": "4c5f00f8cb62c6e0d2471243d28150b473ef592f",
        "path": "iching/iching.json",
        "record_key": "id=17; scripture",
        "url": "https://github.com/john-walks-slow/open-iching/blob/4c5f00f8cb62c6e0d2471243d28150b473ef592f/iching/iching.json"
      }
    },
    {
      "evidence_id": "iching:17:line:2",
      "label": "SOURCE_ORIGINAL",
      "text_kind": "LINE_TEXT",
      "hexagram_id": 17,
      "line_position": 2,
      "language": "zh",
      "text": "系小子，失丈夫。",
      "source": {
        "repository": "john-walks-slow/open-iching",
        "commit": "4c5f00f8cb62c6e0d2471243d28150b473ef592f",
        "path": "iching/iching.json",
        "record_key": "id=17; lines.id=2; scripture",
        "url": "https://github.com/john-walks-slow/open-iching/blob/4c5f00f8cb62c6e0d2471243d28150b473ef592f/iching/iching.json"
      }
    }
  ],
  "source_gaps": [
    {
      "expected_evidence_id": "bazi:classical-text",
      "reason": "Chưa có cổ văn Bát Tự được truy xuất cho ví dụ này."
    }
  ],
  "warnings": [
    "Dữ liệu tổng hợp để kiểm tra schema; không phải hồ sơ người dùng hoặc phiên gieo thật.",
    "TST minh họa được giả định bằng giờ đồng hồ; không có phép tính EoT/kinh độ trong ví dụ.",
    "Chưa có biên sai số để đánh giá vùng giáp ranh."
  ]
}
